{"active_player_id":"p4","auction":null,"bank":{"hotels_remaining":8,"houses_remaining":16},"board":[{"group":null,"hotel":false,"houses":0,"index":0,"kind":"GO","mortgaged":false,"name":"Go","owner_id":null,"price":null},{"group":"BROWN","hotel":false,"houses":4,"index":1,"kind":"PROPERTY","mortgaged":false,"name":"Mediterranean Avenue","owner_id":"p3","price":60},{"group":null,"hotel":false,"houses":0,"index":2,"kind":"COMMUNITY_CHEST","mortgaged":false,"name":"Community Chest","owner_id":null,"price":null},{"group":"BROWN","hotel":true,"houses":0,"index":3,"kind":"PROPERTY","mortgaged":false,"name":"Baltic Avenue","owner_id":"p3","price":60},{"group":null,"hotel":false,"houses":0,"index":4,"kind":"TAX","mortgaged":false,"name":"Income Tax","owner_id":null,"price":null},{"group":"RAILROAD","hotel":false,"houses":0,"index":5,"kind":"RAILROAD","mortgaged":true,"name":"Reading Railroad","owner_id":"p3","price":200},{"group":"LIGHT_BLUE","hotel":true,"houses":0,"index":6,"kind":"PROPERTY","mortgaged":false,"name":"Oriental Avenue","owner_id":"p4","price":100},{"group":null,"hotel":false,"houses":0,"index":7,"kind":"CHANCE","mortgaged":false,"name":"Chance","owner_id":null,"price":null},{"group":"LIGHT_BLUE","hotel":true,"houses":0,"index":8,"kind":"PROPERTY","mortgaged":false,"name":"Vermont Avenue","owner_id":"p4","price":100},{"group":"LIGHT_BLUE","hotel":true,"houses":0,"index":9,"kind":"PROPERTY","mortgaged":false,"name":"Connecticut Avenue","owner_id":"p4","price":120},{"group":null,"hotel":false,"houses":0,"index":10,"kind":"JAIL","mortgaged":false,"name":"Jail","owner_id":null,"price":null},{"group":"PINK","hotel":false,"houses":0,"index":11,"kind":"PROPERTY","mortgaged":true,"name":"St. Charles Place","owner_id":"p3","price":140},{"group":"UTILITY","hotel":false,"houses":0,"index":12,"kind":"UTILITY","mortgaged":false,"name":"Electric Company","owner_id":"p4","price":150},{"group":"PINK","hotel":false,"houses":0,"index":13,"kind":"PROPERTY","mortgaged":true,"name":"States Avenue","owner_id":"p3","price":140},{"group":"PINK","hotel":false,"houses":0,"index":14,"kind":"PROPERTY","mortgaged":false,"name":"Virginia Avenue","owner_id":"p4","price":160},{"group":"RAILROAD","hotel":false,"houses":0,"index":15,"kind":"RAILROAD","mortgaged":false,"name":"Pennsylvania Railroad","owner_id":"p4","price":200},{"group":"ORANGE","hotel":false,"houses":2,"index":16,"kind":"PROPERTY","mortgaged":false,"name":"St. James Place","owner_id":"p3","price":180},{"group":null,"hotel":false,"houses":0,"index":17,"kind":"COMMUNITY_CHEST","mortgaged":false,"name":"Community Chest","owner_id":null,"price":null},{"group":"ORANGE","hotel":false,"houses":2,"index":18,"kind":"PROPERTY","mortgaged":false,"name":"Tennessee Avenue","owner_id":"p3","price":180},{"group":"ORANGE","hotel":false,"houses":2,"index":19,"kind":"PROPERTY","mortgaged":false,"name":"New York Avenue","owner_id":"p3","price":200},{"group":null,"hotel":false,"houses":0,"index":20,"kind":"FREE_PARKING","mortgaged":false,"name":"Free Parking","owner_id":null,"price":null},{"group":"RED","hotel":false,"houses":0,"index":21,"kind":"PROPERTY","mortgaged":false,"name":"Kentucky Avenue","owner_id":"p4","price":220},{"group":null,"hotel":false,"houses":0,"index":22,"kind":"CHANCE","mortgaged":false,"name":"Chance","owner_id":null,"price":null},{"group":"RED","hotel":false,"houses":0,"index":23,"kind":"PROPERTY","mortgaged":true,"name":"Indiana Avenue","owner_id":"p3","price":220},{"group":"RED","hotel":false,"houses":0,"index":24,"kind":"PROPERTY","mortgaged":true,"name":"Illinois Avenue","owner_id":"p3","price":240},{"group":"RAILROAD","hotel":false,"houses":0,"index":25,"kind":"RAILROAD","mortgaged":true,"name":"B. & O. Railroad","owner_id":"p3","price":200},{"group":"YELLOW","hotel":false,"houses":0,"index":26,"kind":"PROPERTY","mortgaged":false,"name":"Atlantic Avenue","owner_id":"p4","price":260},{"group":"YELLOW","hotel":false,"houses":0,"index":27,"kind":"PROPERTY","mortgaged":false,"name":"Ventnor Avenue","owner_id":"p4","price":260},{"group":"UTILITY","hotel":false,"houses":0,"index":28,"kind":"UTILITY","mortgaged":true,"name":"Water Works","owner_id":"p3","price":150},{"group":"YELLOW","hotel":false,"houses":0,"index":29,"kind":"PROPERTY","mortgaged":true,"name":"Marvin Gardens","owner_id":"p3","price":280},{"group":null,"hotel":false,"houses":0,"index":30,"kind":"GO_TO_JAIL","mortgaged":false,"name":"Go To Jail","owner_id":null,"price":null},{"group":"GREEN","hotel":false,"houses":0,"index":31,"kind":"PROPERTY","mortgaged":true,"name":"Pacific Avenue","owner_id":"p3","price":300},{"group":"GREEN","hotel":false,"houses":0,"index":32,"kind":"PROPERTY","mortgaged":true,"name":"North Carolina Avenue","owner_id":"p3","price":300},{"group":null,"hotel":false,"houses":0,"index":33,"kind":"COMMUNITY_CHEST","mortgaged":false,"name":"Community Chest","owner_id":null,"price":null},{"group":"GREEN","hotel":false,"houses":0,"index":34,"kind":"PROPERTY","mortgaged":false,"name":"Pennsylvania Avenue","owner_id":"p4","price":320},{"group":"RAILROAD","hotel":false,"houses":0,"index":35,"kind":"RAILROAD","mortgaged":false,"name":"Short Line","owner_id":"p4","price":200},{"group":null,"hotel":false,"houses":0,"index":36,"kind":"CHANCE","mortgaged":false,"name":"Chance","owner_id":null,"price":null},{"group":"DARK_BLUE","hotel":false,"houses":3,"index":37,"kind":"PROPERTY","mortgaged":false,"name":"Park Place","owner_id":"p3","price":350},{"group":null,"hotel":false,"houses":0,"index":38,"kind":"TAX","mortgaged":false,"name":"Luxury Tax","owner_id":null,"price":null},{"group":"DARK_BLUE","hotel":false,"houses":3,"index":39,"kind":"PROPERTY","mortgaged":false,"name":"Boardwalk","owner_id":"p3","price":400}],"phase":"START_TURN","players":[{"bankrupt":true,"bankrupt_to":"p3","cash":0,"doubles_count":0,"get_out_of_jail_cards":0,"in_jail":false,"jail_turns":0,"name":"grok-4.7","player_id":"p1","position":37},{"bankrupt":true,"bankrupt_to":"p4","cash":0,"doubles_count":0,"get_out_of_jail_cards":0,"in_jail":false,"jail_turns":0,"name":"claude-opus-5.5","player_id":"p2","position":6},{"bankrupt":false,"bankrupt_to":null,"cash":11,"doubles_count":0,"get_out_of_jail_cards":0,"in_jail":false,"jail_turns":0,"name":"gpt-6.1-sol","player_id":"p3","position":4},{"bankrupt":false,"bankrupt_to":null,"cash":3450,"doubles_count":0,"get_out_of_jail_cards":0,"in_jail":false,"jail_turns":0,"name":"gemini-4-argon","player_id":"p4","position":14}],"run_id":"campaign-8d77f7b822c6458fa9a5be0e884f74ef-3-6f1cbd6799","schema_version":"v1","trade":null,"turn_index":264}