{"schema_version":"v1","run_id":"mock-25273-a49d65fc","turn_index":7,"phase":"AWAITING_DECISION","active_player_id":"Grok 4.1","players":[{"player_id":"GPT-5.2","name":"GPT-5.2","cash":1032,"position":15,"in_jail":false,"jail_turns":0,"doubles_count":0,"bankrupt":false,"bankrupt_to":null,"get_out_of_jail_cards":0},{"player_id":"Claude Sonnet 4.5","name":"Claude Sonnet 4.5","cash":1360,"position":20,"in_jail":false,"jail_turns":0,"doubles_count":0,"bankrupt":false,"bankrupt_to":null,"get_out_of_jail_cards":0},{"player_id":"Gemini 3","name":"Gemini 3","cash":1292,"position":9,"in_jail":false,"jail_turns":0,"doubles_count":0,"bankrupt":false,"bankrupt_to":null,"get_out_of_jail_cards":0},{"player_id":"Grok 4.1","name":"Grok 4.1","cash":1475,"position":15,"in_jail":false,"jail_turns":0,"doubles_count":0,"bankrupt":false,"bankrupt_to":null,"get_out_of_jail_cards":0}],"bank":{"houses_remaining":32,"hotels_remaining":12},"board":[{"index":0,"kind":"GO","name":"Go","group":null,"price":null,"owner_id":null,"mortgaged":false,"houses":0,"hotel":false},{"index":1,"kind":"PROPERTY","name":"Mediterranean Avenue","group":"BROWN","price":60,"owner_id":null,"mortgaged":false,"houses":0,"hotel":false},{"index":2,"kind":"COMMUNITY_CHEST","name":"Community Chest","group":null,"price":null,"owner_id":null,"mortgaged":false,"houses":0,"hotel":false},{"index":3,"kind":"PROPERTY","name":"Baltic Avenue","group":"BROWN","price":60,"owner_id":null,"mortgaged":false,"houses":0,"hotel":false},{"index":4,"kind":"TAX","name":"Income Tax","group":null,"price":null,"owner_id":null,"mortgaged":false,"houses":0,"hotel":false},{"index":5,"kind":"RAILROAD","name":"Reading Railroad","group":"RAILROAD","price":200,"owner_id":null,"mortgaged":false,"houses":0,"hotel":false},{"index":6,"kind":"PROPERTY","name":"Oriental Avenue","group":"LIGHT_BLUE","price":100,"owner_id":null,"mortgaged":false,"houses":0,"hotel":false},{"index":7,"kind":"CHANCE","name":"Chance","group":null,"price":null,"owner_id":null,"mortgaged":false,"houses":0,"hotel":false},{"index":8,"kind":"PROPERTY","name":"Vermont Avenue","group":"LIGHT_BLUE","price":100,"owner_id":"GPT-5.2","mortgaged":false,"houses":0,"hotel":false},{"index":9,"kind":"PROPERTY","name":"Connecticut Avenue","group":"LIGHT_BLUE","price":120,"owner_id":"GPT-5.2","mortgaged":false,"houses":0,"hotel":false},{"index":10,"kind":"JAIL","name":"Jail","group":null,"price":null,"owner_id":null,"mortgaged":false,"houses":0,"hotel":false},{"index":11,"kind":"PROPERTY","name":"St. Charles Place","group":"PINK","price":140,"owner_id":"Claude Sonnet 4.5","mortgaged":false,"houses":0,"hotel":false},{"index":12,"kind":"UTILITY","name":"Electric Company","group":"UTILITY","price":150,"owner_id":null,"mortgaged":false,"houses":0,"hotel":false},{"index":13,"kind":"PROPERTY","name":"States Avenue","group":"PINK","price":140,"owner_id":null,"mortgaged":false,"houses":0,"hotel":false},{"index":14,"kind":"PROPERTY","name":"Virginia Avenue","group":"PINK","price":160,"owner_id":null,"mortgaged":false,"houses":0,"hotel":false},{"index":15,"kind":"RAILROAD","name":"Pennsylvania Railroad","group":"RAILROAD","price":200,"owner_id":"GPT-5.2","mortgaged":false,"houses":0,"hotel":false},{"index":16,"kind":"PROPERTY","name":"St. James Place","group":"ORANGE","price":180,"owner_id":null,"mortgaged":false,"houses":0,"hotel":false},{"index":17,"kind":"COMMUNITY_CHEST","name":"Community Chest","group":null,"price":null,"owner_id":null,"mortgaged":false,"houses":0,"hotel":false},{"index":18,"kind":"PROPERTY","name":"Tennessee Avenue","group":"ORANGE","price":180,"owner_id":null,"mortgaged":false,"houses":0,"hotel":false},{"index":19,"kind":"PROPERTY","name":"New York Avenue","group":"ORANGE","price":200,"owner_id":null,"mortgaged":false,"houses":0,"hotel":false},{"index":20,"kind":"FREE_PARKING","name":"Free Parking","group":null,"price":null,"owner_id":null,"mortgaged":false,"houses":0,"hotel":false},{"index":21,"kind":"PROPERTY","name":"Kentucky Avenue","group":"RED","price":220,"owner_id":null,"mortgaged":false,"houses":0,"hotel":false},{"index":22,"kind":"CHANCE","name":"Chance","group":null,"price":null,"owner_id":null,"mortgaged":false,"houses":0,"hotel":false},{"index":23,"kind":"PROPERTY","name":"Indiana Avenue","group":"RED","price":220,"owner_id":null,"mortgaged":false,"houses":0,"hotel":false},{"index":24,"kind":"PROPERTY","name":"Illinois Avenue","group":"RED","price":240,"owner_id":null,"mortgaged":false,"houses":0,"hotel":false},{"index":25,"kind":"RAILROAD","name":"B. & O. Railroad","group":"RAILROAD","price":200,"owner_id":null,"mortgaged":false,"houses":0,"hotel":false},{"index":26,"kind":"PROPERTY","name":"Atlantic Avenue","group":"YELLOW","price":260,"owner_id":null,"mortgaged":false,"houses":0,"hotel":false},{"index":27,"kind":"PROPERTY","name":"Ventnor Avenue","group":"YELLOW","price":260,"owner_id":null,"mortgaged":false,"houses":0,"hotel":false},{"index":28,"kind":"UTILITY","name":"Water Works","group":"UTILITY","price":150,"owner_id":null,"mortgaged":false,"houses":0,"hotel":false},{"index":29,"kind":"PROPERTY","name":"Marvin Gardens","group":"YELLOW","price":280,"owner_id":null,"mortgaged":false,"houses":0,"hotel":false},{"index":30,"kind":"GO_TO_JAIL","name":"Go To Jail","group":null,"price":null,"owner_id":null,"mortgaged":false,"houses":0,"hotel":false},{"index":31,"kind":"PROPERTY","name":"Pacific Avenue","group":"GREEN","price":300,"owner_id":null,"mortgaged":false,"houses":0,"hotel":false},{"index":32,"kind":"PROPERTY","name":"North Carolina Avenue","group":"GREEN","price":300,"owner_id":null,"mortgaged":false,"houses":0,"hotel":false},{"index":33,"kind":"COMMUNITY_CHEST","name":"Community Chest","group":null,"price":null,"owner_id":null,"mortgaged":false,"houses":0,"hotel":false},{"index":34,"kind":"PROPERTY","name":"Pennsylvania Avenue","group":"GREEN","price":320,"owner_id":null,"mortgaged":false,"houses":0,"hotel":false},{"index":35,"kind":"RAILROAD","name":"Short Line","group":"RAILROAD","price":200,"owner_id":null,"mortgaged":false,"houses":0,"hotel":false},{"index":36,"kind":"CHANCE","name":"Chance","group":null,"price":null,"owner_id":null,"mortgaged":false,"houses":0,"hotel":false},{"index":37,"kind":"PROPERTY","name":"Park Place","group":"DARK_BLUE","price":350,"owner_id":null,"mortgaged":false,"houses":0,"hotel":false},{"index":38,"kind":"TAX","name":"Luxury Tax","group":null,"price":null,"owner_id":null,"mortgaged":false,"houses":0,"hotel":false},{"index":39,"kind":"PROPERTY","name":"Boardwalk","group":"DARK_BLUE","price":400,"owner_id":null,"mortgaged":false,"houses":0,"hotel":false}],"auction":null,"trade":{"initiator_player_id":"Grok 4.1","counterparty_player_id":"Gemini 3","max_exchanges":5,"exchange_index":0,"history_last_2":[],"current_offer":{"offer":{"cash":400,"properties":[],"get_out_of_jail_cards":0},"request":{"cash":0,"properties":[],"get_out_of_jail_cards":0}}}}